{
  "schemaId": "scorecard-studio.adapter-registry",
  "schemaVersion": 1,
  "contractRevision": "0.3.0-draft.1",
  "requestKeyFormat": {
    "version": 1,
    "separator": "|",
    "arrayPolicy": "declared-set-arrays-deduplicate-and-sort",
    "encoding": "utf8-percent-encoding"
  },
  "availabilityStates": [
    "available",
    "unposted",
    "present-empty",
    "omitted",
    "not-requested",
    "unsupported",
    "not-applicable",
    "ambiguous",
    "partial",
    "failed",
    "stale"
  ],
  "adapters": [
    {
      "id": "schedule",
      "endpointFamily": "schedule",
      "planning": "core",
      "inputFields": [
        { "name": "gamePk", "type": "string", "required": true, "semantic": "Selected MLB game identifier.", "keyOrder": 1 },
        { "name": "sportId", "type": "integer", "required": true, "semantic": "Explicit sport/level context.", "keyOrder": 2 },
        { "name": "selectedDate", "type": "date", "required": true, "semantic": "Schedule selection date used to choose a matching response view.", "keyOrder": 3 },
        { "name": "hydrateProfile", "type": "enum", "required": true, "semantic": "Versioned controlled hydration set.", "keyOrder": 4, "default": "pregame-v1", "allowed": ["pregame-v1"] }
      ],
      "keyFields": ["gamePk", "sportId", "selectedDate", "hydrateProfile"],
      "outputConcepts": [
        { "concept": "selectedGame", "targetHint": "/game", "authority": "authoritative", "identityKeys": ["gamePk", "selectedViewKey"] },
        { "concept": "competitionContext", "targetHint": "/context", "authority": "authoritative", "identityKeys": ["sportId", "gameType", "season"] },
        { "concept": "teamIdentity", "targetHint": "/away/team", "authority": "authoritative", "identityKeys": ["teamId"] },
        { "concept": "originalLineup", "targetHint": "/away/lineup", "authority": "authoritative", "identityKeys": ["teamId", "personId", "battingOrder"] },
        { "concept": "probablePitcher", "targetHint": "/away/startingPitcher", "authority": "authoritative", "identityKeys": ["teamId", "personId"] },
        { "concept": "venueIdentity", "targetHint": "/game/venue", "authority": "authoritative", "identityKeys": ["venueId"] }
      ],
      "capabilityRules": [
        { "id": "mlb-regular", "match": { "sportIds": [1], "gameTypes": ["R"] }, "state": "supported", "evidenceScope": "MLB regular-season current historical and bounded live controls.", "fallback": null },
        { "id": "milb-regular", "match": { "sportIds": [11, 12, 13, 14], "gameTypes": ["R"] }, "state": "conditional", "evidenceScope": "Completed historical games preserved the tested shape; pregame timing remains untested.", "fallback": null },
        { "id": "mlb-other-competition", "match": { "sportIds": [1], "gameTypes": ["S", "F", "D", "L", "W"] }, "state": "conditional", "evidenceScope": "Historical Final controls plus bounded postseason pregame observations.", "fallback": null },
        { "id": "default", "match": { "default": true }, "state": "untested", "evidenceScope": "No broader universal claim.", "fallback": null }
      ],
      "freshness": { "basis": "game-state", "refreshTriggers": ["selection", "status-transition", "milestone", "manual"], "ttlSeconds": null, "cacheFailureAsEmpty": false },
      "partialPolicy": { "unit": "gamePk", "mergeSuccesses": false, "failedUnitAvailability": "failed", "retryFailedOnly": true, "emptyIsFailure": true, "chunkSizeInput": null, "zeroFillFailedUnits": false },
      "errorCodes": ["INPUT_INVALID", "REQUEST_FAILED", "HTTP_STATUS", "PARSE_FAILED", "SOURCE_SHAPE_INVALID", "SELECTION_AMBIGUOUS", "MATCHING_VIEW_MISSING"]
    },
    {
      "id": "feed",
      "endpointFamily": "game-feed",
      "planning": "lazy",
      "inputFields": [
        { "name": "gamePk", "type": "string", "required": true, "semantic": "Selected game identifier.", "keyOrder": 1 },
        { "name": "profile", "type": "enum", "required": true, "semantic": "Bounded accepted feed concepts.", "keyOrder": 2, "default": "officials-venue-v1", "allowed": ["officials-venue-v1"] }
      ],
      "keyFields": ["gamePk", "profile"],
      "outputConcepts": [
        { "concept": "officials", "targetHint": "/game/umpires", "authority": "authoritative", "identityKeys": ["gamePk", "officialId", "officialType"] },
        { "concept": "venueDetail", "targetHint": "/game/venue", "authority": "conditional", "identityKeys": ["venueId"] },
        { "concept": "feedState", "targetHint": "/game/status", "authority": "observation", "identityKeys": ["gamePk"] }
      ],
      "capabilityRules": [
        { "id": "mlb", "match": { "sportIds": [1], "gameTypes": ["R", "S", "F", "D", "L", "W"] }, "state": "supported", "evidenceScope": "Officials and venue detail observed across regular, spring, and postseason controls.", "fallback": "Officials have no accepted alternate; venue detail may use the Venue adapter." },
        { "id": "milb-regular", "match": { "sportIds": [11, 12, 13, 14], "gameTypes": ["R"] }, "state": "conditional", "evidenceScope": "Historical Final feeds returned variable officials and populated team/player maps; pregame timing untested.", "fallback": null },
        { "id": "default", "match": { "default": true }, "state": "untested", "evidenceScope": "No broader universal claim.", "fallback": null }
      ],
      "freshness": { "basis": "game-state", "refreshTriggers": ["consumer-demand", "status-transition", "manual"], "ttlSeconds": null, "cacheFailureAsEmpty": false },
      "partialPolicy": { "unit": "gamePk", "mergeSuccesses": false, "failedUnitAvailability": "failed", "retryFailedOnly": true, "emptyIsFailure": false, "chunkSizeInput": null, "zeroFillFailedUnits": false },
      "errorCodes": ["INPUT_INVALID", "REQUEST_FAILED", "HTTP_STATUS", "PARSE_FAILED", "SOURCE_SHAPE_INVALID"]
    },
    {
      "id": "boxscore",
      "endpointFamily": "game-boxscore",
      "planning": "conditional",
      "inputFields": [
        { "name": "gamePk", "type": "string", "required": true, "semantic": "Related completed game identifier.", "keyOrder": 1 },
        { "name": "relationship", "type": "enum", "required": true, "semantic": "Why this boxscore may affect the selected game.", "keyOrder": 2, "default": "earlierSameDayGame", "allowed": ["earlierSameDayGame"] }
      ],
      "keyFields": ["gamePk", "relationship"],
      "outputConcepts": [
        { "concept": "postgamePlayerTotals", "targetHint": "/away/lineup", "authority": "conditional", "identityKeys": ["gamePk", "personId", "statGroup"] },
        { "concept": "postgameTeamRecord", "targetHint": "/away/team/record", "authority": "conditional", "identityKeys": ["gamePk", "teamId"] }
      ],
      "capabilityRules": [
        { "id": "mlb-earlier-final", "match": { "sportIds": [1], "gameTypes": ["R"] }, "state": "conditional", "evidenceScope": "Accepted only after the earlier same-day game is Final.", "fallback": "People prior-day totals and prior-day Standings record." },
        { "id": "milb", "match": { "sportIds": [11, 12, 13, 14] }, "state": "untested", "evidenceScope": "Embedded Feed boxscore data does not prove separate endpoint parity.", "fallback": "People and Standings within their supported scopes." },
        { "id": "default", "match": { "default": true }, "state": "untested", "evidenceScope": "No broader claim.", "fallback": null }
      ],
      "freshness": { "basis": "prior-game-finality", "refreshTriggers": ["prior-game-final", "manual"], "ttlSeconds": null, "cacheFailureAsEmpty": false },
      "partialPolicy": { "unit": "gamePk", "mergeSuccesses": false, "failedUnitAvailability": "failed", "retryFailedOnly": true, "emptyIsFailure": false, "chunkSizeInput": null, "zeroFillFailedUnits": false },
      "errorCodes": ["INPUT_INVALID", "CAPABILITY_UNSUPPORTED", "REQUEST_FAILED", "HTTP_STATUS", "PARSE_FAILED", "SOURCE_SHAPE_INVALID"]
    },
    {
      "id": "roster",
      "endpointFamily": "team-roster",
      "planning": "core",
      "inputFields": [
        { "name": "teamId", "type": "integer", "required": true, "semantic": "Team whose dated active membership is requested.", "keyOrder": 1 },
        { "name": "date", "type": "date", "required": true, "semantic": "Official calendar date scope.", "keyOrder": 2 },
        { "name": "rosterType", "type": "enum", "required": true, "semantic": "Explicit membership scope.", "keyOrder": 3, "default": "active", "allowed": ["active"] },
        { "name": "hydrateProfile", "type": "enum", "required": true, "semantic": "Versioned person hydration.", "keyOrder": 4, "default": "person-v1", "allowed": ["person-v1"] }
      ],
      "keyFields": ["teamId", "date", "rosterType", "hydrateProfile"],
      "outputConcepts": [
        { "concept": "activeMembership", "targetHint": "/away/bench", "authority": "authoritative", "identityKeys": ["teamId", "date", "personId"] },
        { "concept": "rosterIdentity", "targetHint": "/away/lineup", "authority": "conditional", "identityKeys": ["teamId", "date", "personId"] }
      ],
      "capabilityRules": [
        { "id": "regular", "match": { "sportIds": [1, 11, 12, 13, 14], "gameTypes": ["R"] }, "state": "supported", "evidenceScope": "Dated active rosters sampled through Single-A.", "fallback": null },
        { "id": "mlb-other-competition", "match": { "sportIds": [1], "gameTypes": ["S", "F", "D", "L", "W"] }, "state": "conditional", "evidenceScope": "Endpoint is date-scoped and does not prove competition-specific eligibility.", "fallback": null },
        { "id": "default", "match": { "default": true }, "state": "untested", "evidenceScope": "No broader claim.", "fallback": null }
      ],
      "freshness": { "basis": "date-scope", "refreshTriggers": ["team-date-change", "manual"], "ttlSeconds": null, "cacheFailureAsEmpty": false },